{
  "schemaVersion": 1,
  "id": "esp32s3-storage-dev",
  "target": "esp32s3",
  "adapters": {
    "audio": {
      "driver": "scaffold",
      "capabilities": []
    },
    "speech": {
      "driver": "scaffold",
      "capabilities": []
    },
    "storage": {
      "driver": "fatfs-sqlite",
      "capabilities": ["persistent-sqlite"]
    },
    "im": {
      "driver": "disabled",
      "capabilities": []
    }
  },
  "sdkconfig": [
    "CONFIG_LOG_DEFAULT_LEVEL_INFO=y",
    "CONFIG_FATFS_SECTOR_4096=y",
    "CONFIG_WL_SECTOR_SIZE_4096=y",
    "CONFIG_VOICELIFE_STORAGE_FATFS=y",
    "CONFIG_VOICELIFE_STORAGE_SQLITE=y",
    "CONFIG_ESP_MAIN_TASK_STACK_SIZE=16384",
    "CONFIG_FREERTOS_CHECK_STACKOVERFLOW=2",
    "CONFIG_SPIRAM=y",
    "CONFIG_SPIRAM_MODE_OCT=y",
    "CONFIG_SPIRAM_SPEED_80M=y",
    "CONFIG_SPIRAM_USE_MALLOC=y",
    "CONFIG_SPIRAM_MALLOC_ALWAYSINTERNAL=2048",
    "CONFIG_SPIRAM_MALLOC_RESERVE_INTERNAL=98304",
    "CONFIG_SPIRAM_MEMTEST=n"
  ]
}
