{
  "schemaVersion": 1,
  "id": "esp32s3-voicelife-pcb-serial-voice",
  "target": "esp32s3",
  "adapters": {
    "audio": {
      "driver": "esp32s3-pcm-port",
      "capabilities": [
        "pcm-port",
        "bounded-input",
        "bounded-output",
        "direct-i2s-simplex",
        "transport-frame-assembly"
      ],
      "configRef": "env://VOICELIFE_AUDIO_PROFILE"
    },
    "speech": {
      "driver": "xrobot-websocket",
      "capabilities": ["streaming-asr", "tts", "cancel-generation", "pcm"],
      "configRef": "nvs://linx/websocket_url"
    },
    "storage": {
      "driver": "fatfs-sqlite",
      "capabilities": ["persistent-sqlite"]
    },
    "im": {
      "driver": "voicelife-gateway",
      "capabilities": ["https", "secure-credentials"],
      "configRef": "nvs://im"
    }
  },
  "sdkconfig": [
    "CONFIG_LOG_DEFAULT_LEVEL_INFO=y",
    "CONFIG_NVS_ENCRYPTION=y",
    "CONFIG_NVS_SEC_KEY_PROTECT_USING_HMAC=y",
    "CONFIG_NVS_SEC_HMAC_EFUSE_KEY_ID=0",
    "CONFIG_VOICELIFE_IM_GATEWAY=y",
    "CONFIG_LWIP_DHCP_GET_NTP_SRV=y",
    "CONFIG_LWIP_SNTP_MAX_SERVERS=2",
    "CONFIG_MBEDTLS_CERTIFICATE_BUNDLE_CROSS_SIGNED_VERIFY=y",
    "CONFIG_ESP_CONSOLE_USB_SERIAL_JTAG=y",
    "CONFIG_ESP_CONSOLE_SECONDARY_NONE=y",
    "CONFIG_ESP_WIFI_NVS_ENABLED=n",
    "CONFIG_ESP_MAIN_TASK_STACK_SIZE=16384",
    "CONFIG_FREERTOS_CHECK_STACKOVERFLOW=2",
    "CONFIG_PARTITION_TABLE_CUSTOM_FILENAME=\"config/partitions/voicelife-pcb.csv\"",
    "CONFIG_SPIRAM=y",
    "CONFIG_SPIRAM_MODE_OCT=y",
    "CONFIG_SPIRAM_SPEED_80M=y",
    "CONFIG_SPIRAM_USE_MALLOC=y",
    "CONFIG_FREERTOS_TASK_CREATE_ALLOW_EXT_MEM=y",
    "CONFIG_SPIRAM_MALLOC_ALWAYSINTERNAL=2048",
    "CONFIG_SPIRAM_MALLOC_RESERVE_INTERNAL=98304",
    "CONFIG_SPIRAM_MEMTEST=n",
    "CONFIG_SR_MN_CN_MULTINET7_QUANT=y",
    "CONFIG_FATFS_SECTOR_4096=y",
    "CONFIG_WL_SECTOR_SIZE_4096=y",
    "CONFIG_VOICELIFE_STORAGE_FATFS=y",
    "CONFIG_VOICELIFE_STORAGE_SQLITE=y",
    "CONFIG_VOICELIFE_SERIAL_VOICE_TEST=y"
  ]
}
