{
  "schemaVersion": 1,
  "id": "esp32s3-esp-sparkbot-state-flow",
  "target": "esp32s3",
  "adapters": {
    "audio": { "driver": "esp32s3-es8311-duplex", "capabilities": ["es8311-duplex"], "configRef": "env://VOICELIFE_AUDIO_PROFILE" },
    "speech": { "driver": "xrobot-websocket", "capabilities": ["streaming-asr", "tts", "cancel-generation", "pcm"], "configRef": "nvs://linx/websocket_url" },
    "storage": { "driver": "memory", "capabilities": ["atomic-calendar-write"] },
    "im": { "driver": "disabled", "capabilities": [] }
  },
  "sdkconfig": [
    "CONFIG_LOG_DEFAULT_LEVEL_INFO=y",
    "CONFIG_ESPTOOLPY_FLASHSIZE_16MB=y",
    "CONFIG_PARTITION_TABLE_CUSTOM_FILENAME=\"partitions_sparkbot.csv\"",
    "CONFIG_SPIRAM=y",
    "CONFIG_SPIRAM_MODE_OCT=y",
    "CONFIG_SPIRAM_SPEED_80M=y",
    "CONFIG_SPIRAM_USE_MALLOC=y",
    "CONFIG_SPIRAM_MALLOC_ALWAYSINTERNAL=2048",
    "CONFIG_SPIRAM_MALLOC_RESERVE_INTERNAL=98304",
    "CONFIG_SPIRAM_MEMTEST=n",
    "CONFIG_ESP_MAIN_TASK_STACK_SIZE=12288",
    "CONFIG_VOICELIFE_BOARD_ESP_SPARKBOT=y",
    "CONFIG_NVS_ENCRYPTION=y",
    "CONFIG_NVS_SEC_KEY_PROTECT_USING_HMAC=y",
    "CONFIG_NVS_SEC_HMAC_EFUSE_KEY_ID=1",
    "CONFIG_ESP_CONSOLE_USB_SERIAL_JTAG=y",
    "CONFIG_LV_USE_CLIB_MALLOC=y",
    "CONFIG_LV_FONT_FMT_TXT_LARGE=y",
    "CONFIG_LV_USE_GIF=y",
    "CONFIG_LV_GIF_CACHE_DECODE_DATA=y",
    "CONFIG_SR_WN_WN9L_NIHAOXIAOZHI_TTS3=y",
    "CONFIG_VOICELIFE_STATE_FLOW_TEST=y"
  ]
}
