{
  "schemaVersion": 1,
  "id": "esp32s3-esp-sparkbot",
  "target": "esp32s3",
  "adapters": {
    "audio": {
      "driver": "esp32s3-es8311-duplex",
      "capabilities": [
        "es8311-duplex"
      ],
      "configRef": "env://VOICELIFE_AUDIO_PROFILE"
    },
    "speech": {
      "driver": "xrobot-websocket",
      "capabilities": [
        "streaming-asr",
        "tts",
        "cancel-generation",
        "pcm"
      ],
      "configRef": "nvs://linx/websocket_url"
    },
    "storage": {
      "driver": "fatfs-sqlite",
      "capabilities": [
        "persistent-sqlite",
        "atomic-calendar-write",
        "durable-calendar"
      ]
    },
    "im": {
      "driver": "voicelife-gateway",
      "capabilities": [
        "https",
        "secure-credentials"
      ],
      "configRef": "nvs://im"
    }
  },
  "sdkconfig": [
    "CONFIG_LOG_DEFAULT_LEVEL_INFO=y",
    "CONFIG_COMPILER_OPTIMIZATION_SIZE=y",
    "CONFIG_COMPILER_OPTIMIZATION_ASSERTIONS_SILENT=y",
    "CONFIG_VOICELIFE_STORAGE_FATFS=y",
    "CONFIG_VOICELIFE_STORAGE_SQLITE=y",
    "CONFIG_VOICELIFE_STORAGE_FATFS_EXPECTED_PARTITION_ADDRESS=0x700000",
    "CONFIG_VOICELIFE_STORAGE_FATFS_EXPECTED_PARTITION_SIZE=0x900000",
    "CONFIG_ESPTOOLPY_FLASHSIZE_16MB=y",
    "CONFIG_PARTITION_TABLE_CUSTOM_FILENAME=\"config/partitions/sparkbot.csv\"",
    "CONFIG_SPIRAM=y",
    "CONFIG_SPIRAM_MODE_OCT=y",
    "CONFIG_SPIRAM_SPEED_80M=y",
    "CONFIG_SPIRAM_USE_MALLOC=y",
    "CONFIG_FREERTOS_TASK_CREATE_ALLOW_EXT_MEM=y",
    "CONFIG_SPIRAM_MALLOC_ALWAYSINTERNAL=2048",
    "CONFIG_SPIRAM_MALLOC_RESERVE_INTERNAL=98304",
    "CONFIG_SPIRAM_MEMTEST=n",
    "CONFIG_ESP_MAIN_TASK_STACK_SIZE=24576",
    "CONFIG_VOICELIFE_BOARD_ESP_SPARKBOT=y",
    "CONFIG_VOICELIFE_IM_GATEWAY=y",
    "CONFIG_LWIP_DHCP_GET_NTP_SRV=y",
    "CONFIG_LWIP_SNTP_MAX_SERVERS=2",
    "CONFIG_MBEDTLS_CERTIFICATE_BUNDLE_CROSS_SIGNED_VERIFY=y",
    "CONFIG_NVS_ENCRYPTION=y",
    "CONFIG_NVS_SEC_KEY_PROTECT_USING_HMAC=y",
    "CONFIG_NVS_SEC_HMAC_EFUSE_KEY_ID=1",
    "CONFIG_ESP_CONSOLE_USB_SERIAL_JTAG=y",
    "CONFIG_ESP_CONSOLE_SECONDARY_NONE=y",
    "CONFIG_LV_USE_CLIB_MALLOC=y",
    "CONFIG_LV_FONT_FMT_TXT_LARGE=y",
    "CONFIG_LV_USE_GIF=y",
    "CONFIG_LV_GIF_CACHE_DECODE_DATA=y",
    "CONFIG_SR_MN_CN_MULTINET7_QUANT=y"
  ]
}
