{
  "schemaVersion": 1,
  "id": "esp32s3-esp-sparkbot-demo",
  "target": "esp32s3",
  "adapters": {
    "audio": {
      "driver": "esp32s3-es8311-duplex",
      "capabilities": [
        "es8311-duplex"
      ],
      "configRef": "env://VOICELIFE_AUDIO_PROFILE"
    },
    "speech": {
      "driver": "xrobot-websocket",
      "capabilities": [
        "streaming-asr",
        "tts",
        "cancel-generation",
        "pcm"
      ],
      "configRef": "nvs://linx/websocket_url"
    },
    "storage": {
      "driver": "memory",
      "capabilities": [
        "atomic-calendar-write"
      ]
    },
    "im": {
      "driver": "disabled",
      "capabilities": []
    }
  },
  "sdkconfig": [
    "CONFIG_LOG_DEFAULT_LEVEL_INFO=y",
    "CONFIG_ESPTOOLPY_FLASHSIZE_16MB=y",
    "CONFIG_PARTITION_TABLE_CUSTOM_FILENAME=\"partitions_sparkbot_demo.csv\"",
    "CONFIG_SPIRAM=y",
    "CONFIG_SPIRAM_MODE_OCT=y",
    "CONFIG_SPIRAM_SPEED_80M=y",
    "CONFIG_SPIRAM_USE_MALLOC=y",
    "CONFIG_SPIRAM_MALLOC_ALWAYSINTERNAL=2048",
    "CONFIG_SPIRAM_MALLOC_RESERVE_INTERNAL=98304",
    "CONFIG_SPIRAM_MEMTEST=n",
    "CONFIG_ESP_MAIN_TASK_STACK_SIZE=12288",
    "CONFIG_VOICELIFE_BOARD_ESP_SPARKBOT=y",
    "CONFIG_VOICELIFE_SPARKBOT_HARDWARE_DEMO=y",
    "CONFIG_NVS_ENCRYPTION=y",
    "CONFIG_NVS_SEC_KEY_PROTECT_USING_HMAC=y",
    "CONFIG_NVS_SEC_HMAC_EFUSE_KEY_ID=0"
  ]
}
