{
  "schemaVersion": 1,
  "id": "esp32s3-dev",
  "target": "esp32s3",
  "adapters": {
    "audio": {
      "driver": "scaffold",
      "capabilities": []
    },
    "speech": {
      "driver": "scaffold",
      "capabilities": []
    },
    "storage": {
      "driver": "memory",
      "capabilities": ["atomic-calendar-write"]
    },
    "im": {
      "driver": "disabled",
      "capabilities": []
    }
  },
  "sdkconfig": [
    "CONFIG_LOG_DEFAULT_LEVEL_INFO=y"
  ]
}
